[
  {
    "id": "product-001",
    "name": "Nike Draft Run 01",
    "slug": "nike-draft-run-01",
    "brand": "NIKE",
    "category": "running-shoes",
    "color": "Đen",
    "price": 2899000,
    "originalPrice": null,
    "currency": "VND",
    "onSale": false,
    "description": "Sản phẩm Giày chạy bộ Nike màu Đen, được sử dụng trong mô hình website thương mại điện tử phục vụ nghiên cứu framework.",
    "image": "/products/nike-draft-run-01.webp",
    "imageAlt": "Nike Draft Run 01 màu Đen",
    "sourceUrl": "https://commons.wikimedia.org/wiki/File:Nike_Running_Shoes_Not_Dissected_Reference.jpg",
    "sourceImageUrl": "https://commons.wikimedia.org/wiki/Special:Redirect/file/Nike_Running_Shoes_Not_Dissected_Reference.jpg",
    "featured": true
  },
  {
    "id": "product-002",
    "name": "Nike Draft Run 02",
    "slug": "nike-draft-run-02",
    "brand": "NIKE",
    "category": "running-shoes",
    "color": "Trắng",
    "price": 3199000,
    "originalPrice": null,
    "currency": "VND",
    "onSale": false,
    "description": "Sản phẩm Giày chạy bộ Nike màu Trắng, được sử dụng trong mô hình website thương mại điện tử phục vụ nghiên cứu framework.",
    "image": "/products/nike-draft-run-02.webp",
    "imageAlt": "Nike Draft Run 02 màu Trắng",
    "sourceUrl": "https://commons.wikimedia.org/wiki/File:Nike_Free+_3_running_shoe.jpg",
    "sourceImageUrl": "https://commons.wikimedia.org/wiki/Special:Redirect/file/Nike_Free%2B_3_running_shoe.jpg",
    "featured": false
  },
  {
    "id": "product-003",
    "name": "Nike Draft Sneaker 01",
    "slug": "nike-draft-sneaker-01",
    "brand": "NIKE",
    "category": "sneakers",
    "color": "Trắng",
    "price": 2399000,
    "originalPrice": null,
    "currency": "VND",
    "onSale": false,
    "description": "Sản phẩm Giày sneaker Nike màu Trắng, được sử dụng trong mô hình website thương mại điện tử phục vụ nghiên cứu framework.",
    "image": "/products/nike-draft-sneaker-01.webp",
    "imageAlt": "Nike Draft Sneaker 01 màu Trắng",
    "sourceUrl": "https://commons.wikimedia.org/wiki/File:Nike_Cortez_shoes.jpg",
    "sourceImageUrl": "https://commons.wikimedia.org/wiki/Special:Redirect/file/Nike_Cortez_shoes.jpg",
    "featured": true
  },
  {
    "id": "product-004",
    "name": "Nike Draft Sneaker 02",
    "slug": "nike-draft-sneaker-02",
    "brand": "NIKE",
    "category": "sneakers",
    "color": "Xám",
    "price": 2599000,
    "originalPrice": null,
    "currency": "VND",
    "onSale": false,
    "description": "Sản phẩm Giày sneaker Nike màu Xám, được sử dụng trong mô hình website thương mại điện tử phục vụ nghiên cứu framework.",
    "image": "/products/nike-draft-sneaker-02.webp",
    "imageAlt": "Nike Draft Sneaker 02 màu Xám",
    "sourceUrl": "https://commons.wikimedia.org/wiki/File:Gym_Shoes_-_Nike_Metcon_%2851080442242%29.jpg",
    "sourceImageUrl": "https://commons.wikimedia.org/wiki/Special:Redirect/file/Gym_Shoes_-_Nike_Metcon_%2851080442242%29.jpg",
    "featured": false
  },
  {
    "id": "product-005",
    "name": "Nike Draft Slide 01",
    "slug": "nike-draft-slide-01",
    "brand": "NIKE",
    "category": "slides",
    "color": "Đen",
    "price": 1099000,
    "originalPrice": null,
    "currency": "VND",
    "onSale": false,
    "description": "Sản phẩm Dép quai ngang Nike màu Đen, được sử dụng trong mô hình website thương mại điện tử phục vụ nghiên cứu framework.",
    "image": "/products/nike-draft-slide-01.webp",
    "imageAlt": "Nike Draft Slide 01 màu Đen",
    "sourceUrl": "https://commons.wikimedia.org/wiki/File:Nike_shoes.jpg",
    "sourceImageUrl": "https://commons.wikimedia.org/wiki/Special:Redirect/file/Nike_shoes.jpg",
    "featured": false
  },
  {
    "id": "product-006",
    "name": "Nike Draft Slide 02",
    "slug": "nike-draft-slide-02",
    "brand": "NIKE",
    "category": "slides",
    "color": "Trắng",
    "price": 1199000,
    "originalPrice": null,
    "currency": "VND",
    "onSale": false,
    "description": "Sản phẩm Dép quai ngang Nike màu Trắng, được sử dụng trong mô hình website thương mại điện tử phục vụ nghiên cứu framework.",
    "image": "/products/nike-draft-slide-02.webp",
    "imageAlt": "Nike Draft Slide 02 màu Trắng",
    "sourceUrl": "https://commons.wikimedia.org/wiki/File:Nike_shoes_2.jpg",
    "sourceImageUrl": "https://commons.wikimedia.org/wiki/Special:Redirect/file/Nike_shoes_2.jpg",
    "featured": false
  },
  {
    "id": "product-007",
    "name": "Nike Draft Flip 01",
    "slug": "nike-draft-flip-01",
    "brand": "NIKE",
    "category": "flip-flops",
    "color": "Xanh Dương",
    "price": 899000,
    "originalPrice": null,
    "currency": "VND",
    "onSale": false,
    "description": "Sản phẩm Dép xỏ ngón Nike màu Xanh Dương, được sử dụng trong mô hình website thương mại điện tử phục vụ nghiên cứu framework.",
    "image": "/products/nike-draft-flip-01.webp",
    "imageAlt": "Nike Draft Flip 01 màu Xanh Dương",
    "sourceUrl": "https://commons.wikimedia.org/wiki/File:Nike_Running_Shoes.jpg",
    "sourceImageUrl": "https://commons.wikimedia.org/wiki/Special:Redirect/file/Nike_Running_Shoes.jpg",
    "featured": false
  },
  {
    "id": "product-008",
    "name": "Nike Draft Clog 01",
    "slug": "nike-draft-clog-01",
    "brand": "NIKE",
    "category": "clogs",
    "color": "Xám",
    "price": 1999000,
    "originalPrice": null,
    "currency": "VND",
    "onSale": false,
    "description": "Sản phẩm Giày clog Nike màu Xám, được sử dụng trong mô hình website thương mại điện tử phục vụ nghiên cứu framework.",
    "image": "/products/nike-draft-clog-01.webp",
    "imageAlt": "Nike Draft Clog 01 màu Xám",
    "sourceUrl": "https://commons.wikimedia.org/wiki/File:Nike_running_sneakers_2013-10-06_08-34.jpg",
    "sourceImageUrl": "https://commons.wikimedia.org/wiki/Special:Redirect/file/Nike_running_sneakers_2013-10-06_08-34.jpg",
    "featured": false
  },
  {
    "id": "product-009",
    "name": "Nike Draft Sneaker 03",
    "slug": "nike-draft-sneaker-03",
    "brand": "NIKE",
    "category": "sneakers",
    "color": "Đỏ",
    "price": 2799000,
    "originalPrice": null,
    "currency": "VND",
    "onSale": false,
    "description": "Sản phẩm Giày sneaker Nike màu Đỏ, được sử dụng trong mô hình website thương mại điện tử phục vụ nghiên cứu framework.",
    "image": "/products/nike-draft-sneaker-03.webp",
    "imageAlt": "Nike Draft Sneaker 03 màu Đỏ",
    "sourceUrl": "https://commons.wikimedia.org/wiki/File:Vintage_Nike_Running_Shoes_at_the_ShoeZeum.jpg",
    "sourceImageUrl": "https://commons.wikimedia.org/wiki/Special:Redirect/file/Vintage_Nike_Running_Shoes_at_the_ShoeZeum.jpg",
    "featured": false
  },
  {
    "id": "product-010",
    "name": "Nike Draft Run 03",
    "slug": "nike-draft-run-03",
    "brand": "NIKE",
    "category": "running-shoes",
    "color": "Xanh Navy",
    "price": 3499000,
    "originalPrice": null,
    "currency": "VND",
    "onSale": false,
    "description": "Sản phẩm Giày chạy bộ Nike màu Xanh Navy, được sử dụng trong mô hình website thương mại điện tử phục vụ nghiên cứu framework.",
    "image": "/products/nike-draft-run-03.webp",
    "imageAlt": "Nike Draft Run 03 màu Xanh Navy",
    "sourceUrl": "https://commons.wikimedia.org/wiki/File:Zoom_elite_2.png",
    "sourceImageUrl": "https://commons.wikimedia.org/wiki/Special:Redirect/file/Zoom_elite_2.png",
    "featured": false
  },
  {
    "id": "product-011",
    "name": "Adidas Draft Run 01",
    "slug": "adidas-draft-run-01",
    "brand": "ADIDAS",
    "category": "running-shoes",
    "color": "Trắng",
    "price": 2999000,
    "originalPrice": null,
    "currency": "VND",
    "onSale": false,
    "description": "Sản phẩm Giày chạy bộ Adidas màu Trắng, được sử dụng trong mô hình website thương mại điện tử phục vụ nghiên cứu framework.",
    "image": "/products/adidas-draft-run-01.webp",
    "imageAlt": "Adidas Draft Run 01 màu Trắng",
    "sourceUrl": "https://commons.wikimedia.org/wiki/File:Adidas_black_shoes.JPG",
    "sourceImageUrl": "https://commons.wikimedia.org/wiki/Special:Redirect/file/Adidas_black_shoes.JPG",
    "featured": true
  },
  {
    "id": "product-012",
    "name": "Adidas Draft Run 02",
    "slug": "adidas-draft-run-02",
    "brand": "ADIDAS",
    "category": "running-shoes",
    "color": "Đen",
    "price": 3299000,
    "originalPrice": null,
    "currency": "VND",
    "onSale": false,
    "description": "Sản phẩm Giày chạy bộ Adidas màu Đen, được sử dụng trong mô hình website thương mại điện tử phục vụ nghiên cứu framework.",
    "image": "/products/adidas-draft-run-02.webp",
    "imageAlt": "Adidas Draft Run 02 màu Đen",
    "sourceUrl": "https://commons.wikimedia.org/wiki/File:Adidas_shoe.JPG",
    "sourceImageUrl": "https://commons.wikimedia.org/wiki/Special:Redirect/file/Adidas_shoe.JPG",
    "featured": false
  },
  {
    "id": "product-013",
    "name": "Adidas Draft Sneaker 01",
    "slug": "adidas-draft-sneaker-01",
    "brand": "ADIDAS",
    "category": "sneakers",
    "color": "Be",
    "price": 2199000,
    "originalPrice": null,
    "currency": "VND",
    "onSale": false,
    "description": "Sản phẩm Giày sneaker Adidas màu Be, được sử dụng trong mô hình website thương mại điện tử phục vụ nghiên cứu framework.",
    "image": "/products/adidas-draft-sneaker-01.webp",
    "imageAlt": "Adidas Draft Sneaker 01 màu Be",
    "sourceUrl": "https://commons.wikimedia.org/wiki/File:Adidas_Superstar_shoes_pair.jpg",
    "sourceImageUrl": "https://commons.wikimedia.org/wiki/Special:Redirect/file/Adidas_Superstar_shoes_pair.jpg",
    "featured": true
  },
  {
    "id": "product-014",
    "name": "Adidas Draft Sneaker 02",
    "slug": "adidas-draft-sneaker-02",
    "brand": "ADIDAS",
    "category": "sneakers",
    "color": "Xanh Dương",
    "price": 2499000,
    "originalPrice": null,
    "currency": "VND",
    "onSale": false,
    "description": "Sản phẩm Giày sneaker Adidas màu Xanh Dương, được sử dụng trong mô hình website thương mại điện tử phục vụ nghiên cứu framework.",